id,keyword,location,text,target_relabeled
7960,razed,no_location,the latest more homes razed by northern california wildfire abc news,1
7962,razed,Nigeria,tension in abia as inec offices razed governor ikpeazu pdp apga react,1
7963,razed,"Tulsa, OK",the latest more homes razed by northern california wildfire the latest on wildfires burning in california and,1
7965,razed,no_location,the latest more homes razed by northern california wildfire,1
7970,razed,no_location,the latest more homes razed by northern california wildfire lynchburg news and advance,1
7971,razed,WorldWide,news the latest more homes razed by northern california wildfire new york times tafs fb100,1
7980,razed,North,petereallen huffpostuk bbc5live how significant do you think the iconic pictures of church maybe ruins and less substantial efforts razed,0
7984,razed,"Ames, IA",david vonderhaar at least you were sincere,1
7990,razed,San Diego California 92101,more homes razed by northern california wildfire sandiego,1
7991,razed,Nairobi-KENYA,george njenga the hero saved his burning friend from a razing wildfire,1
7992,razed,"Erie, PA",today will be another dualcom with imrazed if you enjoyed yesterdays check out todays at 5 prime minister easter,0
7994,razed,no_location,the latest more homes razed by northern california wildfire abc news good night,1
8001,razed,no_location,the latest more homes razed by northerncalifornia wildfire zipped news,1
8008,razed,"Augusta, Maine, 04330",vassalboro house to be razed to make way for public gazebo petelmcguire reports,0
8009,refugees,no_location,this justmarried turkish couple gave 4000 syrian refugees an incredible gift fed them instead of family friends,1
8010,refugees,Ad Majorem Dei Glorium,police monitoring 200 jihadis in poland via freedomoutpost,1
8012,refugees,"Aurora, Ontario ",turkish newlyweds donate wedding money what a beautiful gesture still have faith in humanity,0
8013,refugees, Baku & Erzurum ,this justmarried turkish couple gave 4000 syrian refugees an incredible gift washingtonpost,1
8015,refugees,Statute Of Limitations_,repulsive refugeesvictimiserdutton evangelicalliarabbott co lnp on a dupe the press overdrive choppergatebronwynbishopauspol,0
8016,refugees,paradise,retweet cameroon repatriating about 12000 nigerian refugees due to boko haram,1
8017,refugees," BC, US, Asia or Europe.",newlyweds feed syrian refugees at their wedding cbc news latest canada world entertainment and business news,0
8018,refugees,no_location,wowo 12000 nigerian refugees repatriated from cameroon,1
8019,refugees,no_location,hmm 12000 nigerian refugees repatriated from cameroon,1
8020,refugees,no_location,whao 12000 nigerian refugees repatriated from cameroon,1
8021,refugees,St PetersburgFL,imagine an entire aisle dedicated to making people look like serbian refugees director of whole foods clothing section,0
8023,refugees,EspaÌ±a,viral spell couple spend wedding day feeding 4000 syrian refugees httpt see more,0
8024,refugees,no_location,reaad plsss 12000 nigerian refugees repatriated from cameroon,1
8025,refugees,Tarragona,top story viral spell couple spend wedding day feeding 4000 syrian refugees see more,0
8026,refugees,no_location,refugee connections indiegogo campaign will be going live tomorrow supoort united states and help launch the only online community for refugees,1
8028,refugees,no_location,you all read 12000 nigerian refugees repatriated from cameroon,1
8029,refugees,no_location,short of throwing them overboard himself i do not think any other leader could do much worse by refugees than tony abbott worst prime minister ever,1
8030,refugees,Warri,cameroon repatriated 12000 nigerian refugees,1
8031,refugees,Melbourne Australia,captain abbott must go down with lnp boat refugees christianvalues,0
8032,refugees,no_location,a turkish couple spent their wedding day feeding 4000 syrian refugees a turkish couple who got marrie,0
8034,refugees,"21.462446,-158.022017",how one couple is using drones to save refugees at the worlds deadliest border,1
8037,refugees,"Bangalore, India",turkish couple decided to feed 4000 syrian refugees as part of their wedding celebrations,0
8038,refugees,Skyhold,fadelurker dalinthanelan right now even after two years there were still refugees camped just south of redcliffe village and aidan,1
8039,refugees,Australia,newlyweds feed thounited states of americands of syrian refugees instead of hosting a banquet wedding dinner age news,0
8040,refugees,"Amman,Jordan",in photos the young refugees forced to flee burundis violence vice news see more,1
8043,refugees,tripoli international airport,kristindavis un refugees thank you un and refugees for helping so many people in need all over the world,0
8045,refugees,no_location,newlyweds feed thounited states of americands of syrian refugees instead of hosting a banquet wedding dinner via shake my head,1
8047,refugees,"Auckland, New Zealand",pacic media centre articles australia rsf protests over new security gag over reporting on,0
8049,refugees,no_location,recap 12000 nigerian refugees repatriated from cameroon,1
8055,refugees,"NYC,US - Cali, Colombia",the most generous bride on earth couple feeds 4000 syrian refugees on their wedding day via thedailybeast love it,0
8057,refugees,QLD Australia,the 46 returned refugees what were they fleeing from how will the vietnamese govt treat them now they are returned dutton presser,1
8058,refugees,"Geneva, Switzerland",chpsre retweet refugees for our followers in paris do visit a dream of humanity exhibition by rezaphotography,1
8060,rescue,Trinidad & Tobago,policyholders object to clico rescue plan,1
8061,rescue,SF Bay Area,do not panik kelbytomlinson to the rescue,0
8062,rescue,#HarleyChick#PJNT#RunBenRun,coastal german shepherd rescue original content shared a link animal rescue,0
8064,rescue,"Toronto, Ontario",ud rescue structural collapse scott road ypres road york 14 trucks,1
8065,rescue,New Jersey,rescue of the day its world cat day saturday aug 8th black blackwhite cats just 5 newbeginningsanimalrescue,0
8066,rescue,Big NorthEast Litter Box,i am on 2 blood pressure meds and it is still probably through the roof long before the ppact story broke i was involved in animal rescue,0
8068,rescue,no_location,coastal german shepherd rescue original content shared a link ecstatic rescued racco animal rescue,0
8069,rescue,no_location,suggs vivian to the rescue psychrewatch,0
8070,rescue,"Surry Hills, Sydney",any lengths to rescue a cat in need,0
8071,rescue,Sand springs oklahoma,last chance animal rescue has 3 new posts animal rescue,0
8074,rescue,no_location,sammy and todd always to the rescue may not be in uniform but still to the rescue laughing my ass off forever kfc fam,0
8079,rescue,USA,lunch for the crew is made night night it is been a long day peaceloverescue,0
8081,rescue,Thornton  Colorado,tell the united nations plantations are not forests via rainforestresq,0
8083,rescue,Wanderlust,mary coming to troy rescue,0
8085,rescue,Karachi,floodzone general raheel sharif visits chitral he also lauded the efforts of fwo army troops and army aviation in rescue opera,1
8088,rescue,no_location,lisavanderpump how many dogs do you have and are they all rescue dogs,0
8089,rescue,India,officials rescue 367 migrants off libya 25 bodies found fox news news,1
8094,rescued,United States,zakbagans this is sabrina my dad rescued her from some dude who kept her in a cage we have had her since i was 4,1
8095,rescued,no_location,britons rescued amid himalaya floods,1
8096,rescued,Nigeria,4 kidnapped ladies rescued by police in enugu nigerian tribune,1
8097,rescued,Jakarta,rescued med migrants arrive in sicily,1
8098,rescued,"Ohio, USA",tennoatax i hand you a glass of water and sit down i was rescued by a tenno i have lived in my ship around the dojo for about a year,0
8100,rescued,watford,trust united states to get rescued by the dopey ones val is hilarious shame she is probably going to die emmerdale,0
8101,rescued,West Hollywood,summer summervibes california puppy pitmix rescued brixton banksy happy mybabies,0
8102,rescued,Kent,man who buried dog alive thought no one would find her but she was rescued just in time,0
8103,rescued,Canada,10monthold baby girl was rescued by coastguard after she floated half a mile out to sea social news,1
8105,rescued,The Multiverse,but now skyrim awaits to be rescuedagain,0
8109,rescued,Bournemouth,the finnish hip hop pioneer paleface will be rescued from a drifting raft and brought into the container later enkelbiljett menolippu,0
8110,rescued,Jammu | Kashmir | Delhi,18 bovines rescued 3 smugglersnabbed,1
8111,rescued,no_location,funds needed for rescued then abandoned cocker spaniels,0
8112,rescued,no_location,i liked a youtube video romanatwoodvlogs rescued sick kittens,0
8113,rescued,no_location,news britons rescued amid himalaya floods,1
8116,rescued,southern california,a brave little dog gets rescued from the river his recovery will inspi via youtube,0
8118,rescued,"Philadelphia, Pennsylvania USA",homeless man traveling across united states of america with 11 stray dogs he rescued gets a helping hand from strangers via reshareworthy,0
8119,rescued,no_location,brittanypetko breaking news tonight kids were rescued from play room after a week with no food or water do to parents sex life haha,1
8120,rescued,"Winston-Salem, NC",you can only be rescued from where you actually are and not from where you pretend you are giorgio hiatt,0
8121,rescued,"Huntley, IL",we rescued my dog at least 9 years ago she is old but still sweet as ever zakbagans,0
8122,rescued,NIGERIA,rescued med migrants arrive in sicily hundreds of migrants rescued,1
8125,rescued,The green and pleasant land.,why were not they taken back to africa once rescued c4 news,1
8126,rescued,Earth,migrants rescued after boat capsizes off libya,1
8128,rescued,no_location,young children among those rescued from capsized boat off libya via irishtimesworld,1
8129,rescued,no_location,heroes a springer spaniel her dog dad rescued a stranded baby dolphin,1
8130,rescued,"Leeds, U.K.",trust united states to get rescued by the dopey ones emmerdale summer fate,0
8131,rescued,Ireland,three beached whales rescued in kerry,1
8133,rescued,no_location,rescued tb goes on to ribbon at hits via offtrackhorse,0
8135,rescued,no_location,turn back to me i have rescued you and swept away your sins as though they were clouds isaiah 4422 contemporary english version,0
8136,rescued,"Pennsylvania, USA",zakbagans pets r like part of the family i love animals the last 2 pets i had i rescued breaks my heart when animals are mistreated,0
8137,rescued,Boston MA,i liked a youtube video homeless dog living in a cardboard box gets rescued has a heartwarming,0
8138,rescued,Canada,angry mistrustful rescued elephant finds peace and friendship in her new home photos via onegreenplanet,0
8140,rescued,Jakarta/Kuala Lumpur/S'pore,photo hundreds of rescued migrants await disembarkment from an irish naval vessel at palermo italy tconnellyr,1
8142,rescuers,Nigeria,video we are picking up bodies from water rescuers are searching for hundreds of migrants in africa news,1
8143,rescuers,Westerland,video we are picking up bodies from water rescuers are searching for hundreds of migrants in the mediterran,1
8147,rescuers,#iminchina,video we are picking up bodies from water rescuers are searching for hundreds of migrants in the mediterranean,1
8149,rescuers,no_location,world fears over missing migrants in med rescuers search for survivors after a boat carrying as many a news,1
8150,rescuers,Africa,durbanknight rescuers are searching for hundreds of migrants in the mediterranean after a boat carr nosybe,1
8154,rescuers,no_location,i have an unexplainable desire to watch the rescuers childhooddefined,0
8155,rescuers,Nigeria,roddypiperautos fears over missing migrants in med rescuers search for survivors after a boat carrying as ma,1
8156,rescuers,Birmingham,andygilder channel 5 have been doing the same for the rspca with dog rescuersthe infomercial has crept in the back door,0
8158,rescuers,no_location,video we are picking up bodies from water rescuers are searching for hundreds of migrants in the mediterranean after a boat carryi,1
8159,rescuers,no_location,womans global positioning system application guides rescuers to injured biker in marin county,1
8165,rescuers,no_location,last second ebay bid retweet shaolin rescuers dvd 2010 shen chan nan chiang five venoms kung fu please favori,0
8169,rescuers,no_location,world news video we are picking up bodies from water british broadcasting corporation news home rescuers are searching for hundreds of,1
8171,rescuers,no_location,video we are picking up bodies from water rescuers are searching for hundreds,1
8172,rescuers,17th Dimension,ahmazing story of the power animal rescuers have a starving homeless dog with no future was rescued by a person,1
8175,rescuers,no_location,rescuers are searching for hundreds of migrants in the mediterranean after a boat carrying as many as 600 people capsized off the coast of,1
8176,rescuers,Washington,news many deaths in shipwreck rescuers are trying to save hundreds of migrants after the via thenewshype,1
8181,rescuers,Phoenix,when rescuers found him he was barely alive but they had no idea he was allergic to this,1
8182,rescuers,no_location,fears over missing migrants in med rescuers search for survivors after a boat carrying as many as 600 migrant,1
8184,rescuers,no_location,womans global positioning system application guides rescuers to injured biker in marin county sfgate,1
8187,rescuers,no_location,fears over missing migrants in med rescuers search for survivors after a boat carrying as many as 600 migrants,1
8188,rescuers,no_location,rescuers find survivors of nepal earthquake buried,1
8189,rescuers,"Paris, France",rescuers recover body of 37yearold calgary man from lake near vulcan,1
8191,rescuers,"Here, there and everywhere",video we are picking up bodies from water rescuers are searching for hundreds of migrants in the british broadcasting corporation news,1
8195,riot,Belgrade,to all the meat loving feminists of the world riot grill has arrived pop quiz which do you prefer fem art,0
8196,riot,India,stuart broad takes eight before joe root runs riot against aussies,0
8201,riot,"Cardiff, UK",piprhys i predict a riot,1
8202,riot,no_location,teamvodg discovered by nick cannon listen buy mandy rain riot on itunes music itunes blowmandyup,0
8203,riot,no_location,to all the meat loving feminists of the world riot grill has arrived arts,0
8204,riot,Bossland,rascal flatts riot tour atlantic city beach concertaugust 20 20152 tickets,0
8205,riot,World Wide Web,to all the meat loving feminists of the world riot grill hasarrived,0
8208,riot,"Uppsala, Sweden",seriously do we have to do a tactical riot against the headquarters of disney and marvel,0
8209,riot,East London,daniriot keep an eye out we will be looking for lots of new team members in coming daysweeks,0
8210,riot,"Detroit, MI",to all the meat loving feminists of the world riot grill has arrived pop quiz which do you prefer feminist,0
8211,riot,no_location,liveworkshop selfie at booth or riot kappa,1
8212,riot,no_location,acaciapenn i will start a big ass riot send me to jail today motherfuckers shidddd,0
8213,riot,no_location,riot kit bah part of the new concept gear coming for autumnwinter menswear fashion urbanfashion,0
8214,riot,no_location,abrancaballero discovered by nick cannon listen buy mandy rain riot on itunes music itunes blowmandyup,0
8215,riot,no_location,i liked a youtube video thorins thoughts riot and sandbox mode laughing out loud,0
8216,riot,no_location,stuart broad takes eight before joe root runs riot against aussies stuart broad took careerbest figures of 8,0
8217,riot,"Los Angeles, CA",retweeted sarah silverman sarahksilverman soundtrack of my walk starts w tracey ullman they do not know perfect,0
8218,riot,no_location,to all the meat loving feminists of the world riot grill has arrived,1
8219,riot,no_location,after all that time riot should really make an official satan teemo skin,0
8221,riot,"Montana, USA",i liked a youtube video sick riot shield slide spots,0
8223,riot,"Utah, USA",bytorrecilla torrecilla we always info the secret on laughing out loud game check the secret to get 600000 riot points on my bio,0
8224,riot,"Frankfort, KY",transwomen and drag queens of color lead the riot a well known butch lesbian is usually credited for inciting it,0
8225,riot,Los Angeles,eac4au you can now preorder the film on itunes watch 915 yay,0
8226,riot,United Kingdom,without an ally near you cannot use this skill how did you get hired really cause it is making every riot staff member look incompetent,0
8231,riot,In Space,pop quiz which do you prefer feminist revolution or fried ravioliwith porcini and ricotta,0
8232,riot,no_location,to all the meat loving feminists of the world riot grill has arrived oliviamiles01,0
8234,riot,"Sligo and Galway, Ireland",davidjordan88 stephanenny except we do not know who started the riot or if it even makes sense to credit any particular individuals,1
8235,riot,"Los Angeles, CA",trollkrattos juan carlos salvador the secret tips to get 100000 riot points laughing out loud are out now check the secret on on my bio,0
8236,riot,Seattle,southeast dirt riot series crowns champions southeast dirt riot series crowns championsblackfoot id the so,0
8237,riot,Tipperary (Long Way) ,sweetpeas are running riot at the allotment and brightening up a rainy day,1
8239,riot,Malang,riot police intervene after southampton and vitesse arnhem supoorters clash fans clash in buildup to second,1
8240,riot,no_location,jwalkerlyle discovered by nick cannon listen buy mandy rain riot on itunes music itunes blowmandyup,0
8241,riot,"San Francisco, CA",cracker white riot now playing,0
8242,rioting,hertfordshire.,but the government will not care police will stop rioting eventually of protestors eventually some skyscrapers become plantcovered,1
8243,rioting,Dublin,new doco tonight at 9pm setanta sports ireland freeview the largest police presence at a soccer game in ireland stop prevent the rioting,0
8244,rioting,no_location,eric clapton shot the sheriff in 1974 and guess how many people were rioting right none,1
8245,rioting,Spare 'Oom,if they kill off val i am rioting emmerdale,0
8246,rioting,SURROUNDED BY WEEABOOS,money cannot buy happiness is just a lie we tell poor people to keep them from rioting,1
8247,rioting,no_location,bloody hell it is already been upgraded to rioting hyperbole saintsfc,1
8250,rioting,Australia,twitter is doing a count down to the rioting and financial collapse of brazil rio2016,1
8251,rioting,no_location,if that would of been a black dude antioch would be rioting,0
8252,rioting,NYC,runjewels recently met with the british broadcasting corporation to discuss race relations in america the benefits of rioting loveislove,0
8253,rioting,Vidalia GA,reuters people like you should be charged after the inevitable rioting for contributing to it with your lies,0
8254,rioting,"Vista, CA",cindy noonancindy noonanheartbreak in baltimore rioting yahistorical underground railraod,0
8256,rioting,Serva Fidem,leeds fan rioting in embra at a lower tier league cup final dee dum,1
8257,rioting,no_location,still rioting in a couple of hours left until i have to be up for class,1
8258,rioting,"Bellville, Ohio",cloydrivers there were plenty of black people rioting when tosu won the championship as well,0
8259,rioting,trapped in America,evacide the ferguson riots worked this of this the next time you say rioting does not change anything there fixed it for you,1
8261,rioting,A little house in the outback.,british broadcasting corporation news the ass of british insurers says rioting will cost insurers 163millions but police numbers are reduced by blind fat contr,1
8262,rioting,tri state,bhramabull watch run the jewels use facts to defend rioting in ferguson the socially minded duo takes on the,1
8264,rioting,Upstate New York,i think twitter was invented to keep united states insomniacs from rioting in the wee small hours,0
8266,rioting,no_location,blutz10 people are not rioting because justice has been served and that murderer is behind bars simple no justiceno peace justicepeace,1
8267,rioting,no_location,still rioting in to gmail,0
8270,rioting,"Scotland, United Kingdom",jasalhad brianboru67 jimskiv92 hijinks1967 rioting,1
8271,rioting,no_location,ryleedowns02 nevaehburton33 if i do not get my money by tomorrow rioting,0
8274,rioting,no_location,retweet why sweden is not venezuela there have been a few days of rioting in venezuela with the riots directed at gr,1
8276,rioting,Chicora ?? Oakland,davidolszak or the rioting in happy valley after penn state loses,0
8278,rioting,no_location,aelinrhee a group of mascara smeared girls rioting will be horrific i think,1
8279,rioting,no_location,the last time a high profile name was due to be signing for nffc the city was rioting wesley verhoek now a household name do notpanic,1
8280,rioting,"heart of darkness, unholy ?",georgous what alternatives legal alternatives protesting rioting may not be the most peaceful thing but it is a demonstration of how,0
8283,rioting,"Colonial Heights, VA",halljh1720 i am so sick of criminals parents and friends rioting when they are killed by police you do not give a damn when officer is,1
8284,rioting,no_location,blutz10 but the rioting began prior to the decision for the indictment so you are not really making sense at this point,1
8285,rioting,India,the ashes test match is currently more interesting than stupid congress rioting,1
8286,rioting,The Weird Part of Wonderland,people rioting everywhere and i think i would be one of them united states of americamisan love,1
8287,rioting,no_location,football hooligan jailed for rioting before game in scotland was already banned from matches in england uknews,1
8289,rioting,A little house in the outback.,am british broadcasting corporation news the ass british insurers says rioting will cost insurers163millions but police numbers are reduced by blind fat controllers,1
8291,rioting,Cassadaga Florida,fa07af174a71408 i have lived my family have lived in countries where looters were shot on sight where rioting was not tolerated why here,1
8292,rubble,"Columbus, Georgia",refuse to let my life be reduced to rubble when the shit keeps piling up get a shovel expirehc,0
8294,rubble,"Minna, Nigeria",chinas stock market crash are there gems in the rubble chinas stock market crash this su via forbes,0
8295,rubble,no_location,if you go on with this nuclear arms race all you are going to do is make the rubble bounce winston churchill,0
8296,rubble,no_location,accionempresa chinas stock market crash this summer has sparked interest from bargain hunt gerenciatodos,0
8298,rubble,no_location,my parents are so impulsive sometimes i remember coming home to my room filled with dust rubble just because they wanted it redesigned,0
8300,rubble,no_location,turning rubble from disasters into lego bricks you can build houses with this one belongs in crazyideascollege,0
8301,rubble,"Accra,Ghana",360wisenews chinas stock market crash are there gems in the rubble,0
8304,rubble,World,forbes chinas stock market crash are there gems in the rubble chinas stock market crash this summer ha,0
8309,rubble,"Dubai, UAE",forbes europe chinas stock market crash are there gems in the rubble,1
8310,rubble,no_location,chinas stock market crash this summer has sparked interest from bargain hunters and bulls betting on a rebound d,0
8311,rubble,Phoenix Az,jasonpope2 johnfugelsang again i did not say it was i was referring to the main 2 buildings 7 was hit by rubble,1
8312,rubble,Italy,chinas stock market crash are there gems in the rubble,0
8315,rubble,no_location,jun 2015 yemenis search for survivors under the rubble of houses in the old city of sana following an,1
8317,rubble,ON,chinas stock market crash are there gems in the rubble forbesasia,1
8318,rubble,"St. Louis, MO",steve buscemi was a firefightr before fame workd 12hr shifts diggin thru wtc rubble lookg 4 survivors,1
8320,rubble,United States,chinas stock market crash are there gems in the rubble tcot p2 news,0
8321,rubble,Spain - China - Latin America.,chinas stock market crash are there gems in the rubble chinas stock market crash this summer h by forbes,0
8324,rubble,"Chester, IL",i found a diamond in the rubble,0
8329,rubble,West Africa,tnn chinas stock market crash are there gems in the rubble,1
8330,rubble,"Calgary, AB, Canada",chinas stock market crash are there gems in the rubble roimentor yycwalks,1
8335,rubble,"Portland, OR",new post chinas stock market crash are there gems in the rubble,0
8337,rubble,no_location,chinas stock market crash are there gems in the rubble chinas stock market crash this summer has sparked,0
8339,rubble,"Dallas, Tejas",photo postapocalypticflimflam prodding around the rubble,0
8344,ruin,| CA Û¢ GA  |,okgabby damn suh do not let that ruin your year bruh this our year better start carpooling like we did back in the day,0
8345,ruin,"Nashville, TN",if i cannot ruin his mood then i may have lost my direction,0
8346,ruin,no_location,i ruin everything,0
8347,ruin,Depok,quote never let your problems ruin your faith,0
8348,ruin,London / Birmingham,im so anxious though because so many people will me watching me meet them and that makes me uncomfortable but i cant let that ruin the moment,0
8349,ruin,texas,smokers that ruin that new car smell,0
8350,ruin,"Yulee, FL",chrisdyson16 just wait until your friends at mta ruin it sorrybutitstrue,0
8351,ruin,austin tx,i am really sad about red 7 closing yuppies n tourists ruin everything,0
8352,ruin,no_location,always gotta ruin my mood,0
8355,ruin,no_location,i understand you wanting to hang out with your guy friends i will give you your space but do not ruin my trust with you,0
8356,ruin,Garrett,like why on earth would you want anybody to be unhappy do not purposely ruin somebody elses happiness,0
