id,keyword,location,text,target_relabeled
2827,cyclone,"Quezon City, Philippines",severe weather bulletin 6 tropical cyclone warning typhoon hanna issued at 1100 prime minister thursday 06 august,1
2828,cyclone,Geneva,back to the future in vanuatu how cyclone pam has encouraged traditional ways of living,1
2829,cyclone,"Hartford,  connecticut",bank manager asks tom in an interview what is cyclone tom it is the loan given to purchase a bicycle,0
2830,cyclone,"Sioux Falls, SD",excited for cyclone football,0
2832,cyclone,Beside Basketball,talent misdirection cyclone pass ignite pass vanishing drive phantom shot kurokobot,1
2833,cyclone,"Rome, Italy",now on comdev asia radio stations in bangladesh broadcasting programs to address the upcoming cyclone komen,1
2835,cyclone,Tafekop Ga-Matsepe,like a cyclone imperialism spins across the globe militarism crushes peoples and sucks their blood like a,1
2836,cyclone,no_location,1970 mercury cyclone gt hood moulding very nice core cobra jet 429cj gt,0
2838,cyclone,no_location,i am a cyclone passion overblown,0
2839,cyclone,no_location,his majesty emperor salman khans unstoppable cyclone of entertainment humanity bajrangi bhaijaan creating history everywhere crosed 300 cr,0
2841,cyclone,no_location,1970 mercury cyclone gt quarter panel ds rear trim moulding cobra jet 429cj,1
2842,cyclone,no_location,tropical cyclone info soudelor 945hpa maximum wind speed 45ms maximum wind gust speed 60ms,1
2843,cyclone,Melbourne,cyclonereizei if i may ask cyclonesama have you read jailed fate by rindou,0
2844,cyclone,Vilnius,some drugs and alcohol in jackson vroman house,0
2846,cyclone,Geneva,blending the old with the new in vanuatu to prepare for future emergencies,0
2849,cyclone,no_location,wfp wfp delivers food to 165000 bangladesh flood victims after tropical cyclone komen dhaka the united na,1
2851,cyclone,no_location,rohingya houses in kyee nockthie hamlet from taungbazar region in buthidaung were severely damaged in cyclone kasitaroch vivianunhcr,1
2852,cyclone,Made in America,cyclone by double g would be the cherry on top to this outfit ootd doubleghats,0
2853,damage,"PS4, now stop asking",thelegendblue cozmo23 they will probably allow united states to ascend them but not get them to the damage max values,0
2854,damage,no_location,drop it down on a nigga do damage,0
2855,damage,Cheshire. London. #allover,unions say they are supoortive of london yet are prepared to damage it economically 300m last time,0
2856,damage,"Texas, USA",i liked a youtube video gta 5 online collateral damage gta v online pc,0
2857,damage,"Bartholomew County, Indiana",for your information accident property damage3460 limestone lncolyellowstone wayfieldstone dr08052015 193635,1
2858,damage,U.S,fitness knee damage solution,0
2860,damage,My mind is my world,and here i was complaining about phoenix mode in fire emblem turns out ray gigant will have a difficulty option where you take 0 damage,0
2861,damage,no_location,capicapricapri brentobento wha t is this kids damage,0
2863,damage,Catskills,cleared accident with property damage on ny35 eb at ny 100,1
2864,damage,no_location,it is crazy how a phone can do so much damage to a person,0
2865,damage,"Columbia, SC",writebothfists it got pretty windy here too but no damage,0
2866,damage,no_location,reusing advanced in life equipments in transit to drumming champaign damage fdbdp,0
2867,damage,Right here,indigo6e but if you are carful about spotting damage the time of check in why not the time of giving away baggage it is my loss all d wy,0
2869,damage,Texas,storm damage reported in west tennessee,1
2870,damage,"Lawrence, KS via Emporia, KS",hey the royals love doing damage with 2 outs,1
2871,damage,http://twitch.tv/jcmonkey,drothvader cmnevalistis you can keep this please arachys 2 pieces now deals 4000 weapon damage up from 2500,1
2872,damage,Indonesia,mages of fairy tail specialize in property damage natsu dragneel,0
2873,damage,Unknown,bradley brad yeah but being fast and doing extremely high damage is what its all about if you want fast then im gonna have to get you the,1
2875,damage,Unknown,bradley brad the saw is fast af and does great damage i upgraded it a shitton and used it exclusively for a whole playthrough,0
2877,damage,"Marysville, MI",let united states say a tree falls on your fence do you know how your homeowners insurance may help,0
2878,damage,"New Haven, Connecticut",joedawg42 tor for a tor situation only wind damage enhanced wording is key in my opinion,1
2879,damage,no_location,hfxstanfield beelievedc discoverycntr what is happening we hear there is runway lighting damage by a contractor,1
2880,damage,Austin | San Diego,swb1192 if the nda is written to damage your ability to offer your services in the future then you prolly do not want the work anyway,0
2881,damage,??? ?? ??????? ,if trillion crosses the line a 3rd time he does a fieldwide attack that does instant kill damage,1
2882,damage,"Pontevedra, Galicia",np metallica damage inc,0
2883,damage,Somewhere in the Canada,nine inmates charged with causing damage in calgary remand centre riot,1
2884,damage,London/New York,point crosssectarian protest powerful shia cleric says militias must withdrawur fightin isis but we wont forget damage uve done to ur people,1
2885,damage,"261 5th Avenue New York, NY ",does homeowners insurance cover water damage here are some good things to know,1
2886,damage,no_location,beach did damage to my shit,1
2887,damage,no_location,wonderounited states of americallure crosses her arms to cover her hands from doing anymore damage hhello,0
2888,damage,no_location,new post on my blog thesensualeye model cam damage toronto apr 2014 not safe for work pussy ass boobs asian nude,0
2889,damage,Charlotte NC,reported hit runin roadwayproperty damage at 15901 statesville rd,1
2890,damage,no_location,devil may cry 4 special edition vergil vs agnus window mission 6 dmd no damage by leedstraif,0
2891,damage,"Rockville, Maryland",glaucoma occurs when fluid builds up pressure inside eye to a level that may damage optic nerve eyefacts,1
2893,damage,no_location,jsunnews storm damage reported in madison county thunderstorm damage reports ar via,1
2895,damage,no_location,s61231a puncture wound without foreign body of left index finger without damage to nail initial encounter icd10,1
2896,damage,Australia,thank you richarkkirkarch ausinstarchitect for words of warning re queenswharf brisbane via financialreview,0
2898,damage,Your Conversation,this real shit will damage a bitch,0
2899,damage,USAoV,laughing my ass off fuckboy changed his for damage control pseudojuuzo,0
2900,damage,"Bhopal, Madhya Pradesh, India.",michaelwestbiz standard damage control,1
2902,damage,Tennessee,gettinglost jennellensbb munclejim it said they had superficial wounds and it was the pepper spray that did the most damage,1
2905,danger,no_location,heroes of the storm dustinbrowder dad i will not chase you constantly all the time but frequently with a great deal of danger and distraction love,0
2907,danger,#LemonGang ,i believe there is a shirt company now for every animal that has ever been in danger i better start seeing some changes in wildlife,0
2908,danger,ayr,danger of union bears,0
2909,danger,no_location,the signup is open for the falling for danger release day blast and review tour signup here,1
2910,danger,Worldwide,dyannbridges yeshayad check out this rockin preview of clayton bryant danger zone coming soon artists united,0
2911,danger,"San Jose, California",red flag warning for fire danger dry thunderstorms in bay area weather california weather by nwsbayarea,1
2912,danger,Worldwide,carsonrex spaceangelseven check out this rockin preview of clayton bryant danger zone coming soon artists united,0
2913,danger,"Loughborough, England",what is this like i could be in danger or something,1
2915,danger,Killarney,when the last tree is cut down the last fish eaten and the last stream poisoned you will realize that you,0
2916,danger,"Brooklyn, NY",my take away preservation parks r an imposition a danger to african people i never imagined,0
2917,danger,Lahar & Gwalior,indian govt media should take serious concern about their safety they are in danger now,1
2920,danger,"St Paul, MN",training grains of wheat to bare gold in the august heat of their anger i am the no trespass lest you seek danger,0
2921,danger,Atlanta Georgia ,the realrittz fettilootch is slanglucci oppressions greatest danger coming soon the album,0
2922,danger,no_location,morehouse64 it appears our govt has lost an ethical and or moral relevance this means the whole united states of america population is in danger from them,0
2924,danger,"Lincoln, IL",do not like those head first slides especially into home danger,0
2925,danger,World,permits for bear hunting in danger of outnumbering actual bears the licenses for floridas fir saint petersburg,0
2927,danger,Spinning through time.,riverroaming and not too much danger please,0
2929,danger,Atlanta Georgia ,bluebirddenver fettilootch is slanglucci oppressions greatest danger coming soon the album,1
2931,danger,"Boston, MA",uber is looking to repair its recent bad rap with some nonprofit partnerships,0
2932,danger,Hailing from Dayton ,i wish i could get victorias secret on front i am good for it,0
2933,danger,Worldwide,turnedonfetaboo hsjb215 check out this rockin preview of clayton bryant danger zone coming soon artists united,0
2934,danger,"Newcastle Upon Tyne, England",thetxi gunnersfan89 why would arsenal fans want that west ham will be in a relegation battle this season no danger for afc on sun,0
2935,danger,Atlanta Georgia ,remainontop fettilootch is slanglucci oppressions greatest danger coming soon the album,0
2936,danger,Atlanta Georgia ,nuggets fettilootch is slanglucci oppressions greatest danger coming soon the album,0
2937,danger,no_location,the danger and excitement of underwater cave diving,0
2939,danger,no_location,the girl that i wanna save is like a danger to my health try being with somebody that wanna be somebody else,0
2941,danger,Instagram: trillrebel_,guns are for protection that shit really should not be used unless your life in danger,0
2942,danger,ALWAYS DYING NEVER RESTING,so thirsty yall in danger of dehydration,1
2943,danger,"San Jose, CA",thunderstorms with little rain expected in central california high fire danger weather california weather,1
2944,danger,2005 |-/,i wanna get a danger days tattoo so bad how cool would that spider look like on someones wrist or smth,0
2945,danger,Israel,in my experience if you are always angry and critical as a pundit you are in grave danger of going off the rails 1,0
2946,danger,Uruguay / Westeros / Gallifrey,i am not in danger skyler i am the danger,0
2947,danger,"Kansas City, MO",too dangerous for them but it is ok for the rest of united states to be in danger,0
2948,danger,"Silver Spring, MD",investigate why robert mueller did not respond to my complaints since nov 2011 just left meson out her in danger,0
2950,danger,Jersey - C.I,honestly though modibo maiga is stealing a living fuck all about him im past my best but still more of a danger than that fucktard coyi,1
2952,danger,no_location,fear has a way of making united states see danger where there is none contemplating the logic behind the situation and find the courage to engage it,0
2953,dead,no_location,joel 228 and book of acts 217,0
2954,dead,Afghanistan,17 dead as afghanistan aircraft crashes an afghan military helicopter has crashed in a remote region of the s,1
2955,dead,Sweden,silent0siris why not even more awesome norse landscapes with loads of atmosphere and life than boringdead snotgreen wastelands,0
2956,dead,no_location,i miss my longer hairbut it was so dead anyways it was not even hair,0
2957,dead,no_location,cjbanning 4sake of argsuppose preborn has attained individl rightsgenerally courtof law forbids killing unless dead person did something,0
2959,dead,London,remember that time goku gave life to a dead birb what the hell goku,0
2960,dead,"Orlando, FL",naaa i bee dead like a legit zombie i feel every sore part in my body,0
2963,dead,no_location,we just happened to get on the same road right behind the buses i am dead serious,0
2965,dead,Atmosphere,laugh my fucking ass off fucking luis hhahaha im dead,0
2969,dead,no_location,i just watched emmerdale nd i do not know who most of them are but a slightly attractive man named ross just got beat up nd now he is dead,1
2970,dead,Glasgow,soapscoop i need you to confirm that ross is dead cause i dont trust anyone else yh,0
2971,dead,no_location,gailsimone iwasdisappointedby telltales the walking dead good characters story but no real gameplay and too many performance issues,0
2973,dead,no_location,beforeitsnews hundreds feared dead after libyan migrant boat capsizes during rescue,1
2974,dead,somewhere in Portugal,if its a war you came to see you will never see a waved white flag in front me i cant end up dead i wont be misled,0
2975,dead,South Stand,jones94kyle oh fuck sake he is dead,0
2976,dead,dundalk ireland,emmerdale is ross really dead ask charley,0
2980,dead,no_location,don avoid wearing dead black flaming red and stark white so much and especially at debate go with your blue gold brown even to shoes and,0
2982,dead,no_location,perspectives on the grateful dead critical writings contributions to the study,1
2983,dead,"Sochi, KDA, RU",hlportal hello i am looking for mod cold ice i saw it on your site but link to download dead maybe you have it and share with me thanks,0
2984,dead,"ÌÏT: -26.695807,27.837865",kg4vaal laughing my ass offvv hard the ny is the the new trend babalaughing my ass offwelcome to nyozi kwaaaaadead,0
2987,dead,South Stand,jones94kyle now i have said all this he is dead and no one else dies,0
2988,dead,You're not 19 forever   ,is ross dead noooooooooooo michael parr,0
2990,dead,"Kettering, OH",thinking of the time that my friend bailed the nite before a dead showwent alone had a great time all alone and free to dance front row,0
2991,dead,United States,typhoon soudelor taking dead aim at taiwan,1
2992,dead,no_location,ask charley emmerdale how emotional are you that ross is dead emmerdale 5,0
2993,dead,Planet Earth,man found dead in demi moores swimming pool,1
2995,dead,Spare 'Oom,that is it val is dead im suing,1
2998,dead,no_location,atchisonsean he is dead,0
3000,dead,United States,wyrmwood road of the dead 2014 was fucking awesome and it had an awesome ending too awesome one,0
3001,dead,Milton Keynes ,cannot believe ross is dead emmerdale michael parr emmerdale summerfate,0
3003,death,no_location,i will only call or text 2 niggas my bff my boyfriend i love my boys to death no other niggas can hold my attention like them,0
3004,death,ATL??AL??,i hate to talking otp with my grandma i mean i love her as to death but she talk so damn much ssshhheeesshh,0
3005,death,UPTOWN ,until my death i will forever rep the jets,1
3006,death,no_location,my vibrator shaped vape done busted,0
3009,death,PROV,death threats on a nigga life well then we gon see,0
3010,death,"Novi, MI",adult dies of plague in colorado,1
3011,death,New York,xbox 360 pro console red ring of death full read by ebay,0
3012,death,"Buenos Aires, Argentina",going back to gainesville will be the death of me,1
3013,death,on the go,a year later ferguson sees change but asks if its real,0
3014,death,no_location,papiichampoo what i enjoy most about the obama era is the civility prez says gop supoorts iranian death to,0
3015,death,no_location,i feel like death,0
3016,death,The UK,i liked a youtube video from jeromekem dj hazard death sport,0
3018,death,no_location,i tell my cousins i do not wanna hang out and they text me saying we are coming over honestly do you have a death wish,0
3019,death,no_location,rss judge orders texas to recognize spouse on samesex death certificate,0
3021,death,mpls. ,her loyalty mission involves her kicking a shitty nobleman to death i love this elven weirdo,0
3022,death,"Kensington, MD",there is a way which seemeth right unto a man but the end thereof are the ways of death,1
3023,death,Buffalo/DC,kellkane thanks i narrowly averted death that was fun you are right,1
3025,death,no_location,ariana grande scream queens katherines death,0
3026,death,"Sylacauga, Alabama",allahsfinest12 death to muslims,1
3027,death,no_location,going to starve to death,0
3029,death,no_location,ted cruz bashes obama comparison gop to iranians shouting death to america,0
3034,death,no_location,new crime knowing your rights punishable by death,0
3036,death,USA,i had no issues uploading death to smoochy or awakenings clips to youtube but for some reason bicentennial man is being a pain in the ass,0
3037,death,To The Right of You!,ted cruz bashes obama comparison gop to iranians shouting death to america tcot,1
3038,death,Cyprus,cyprus news analysis mullah omars death may split talibans ranks omars demise would certainly lead,1
3039,death,kansas,i feel like deathholy molys,0
3042,death,"Los Angeles,CA, USA",video slain mexican journalist unknowingly predicted his own death via breitbartnews,0
3043,death,"Portland, OR",there is this old lady rockin out to death metal in her sedan downtown smoking a cigarette i found my real mom,0
3044,death,Carry On Jutta!!!,afghan peace talks in doubt after mullah omars death financial times mullah,0
3045,death,Home of the Takers.,you all pusssssssssy and shoook to death of me,0
3047,death,"New York, New York",the first trial in the death of cecil the lion was just postponed,0
3048,death,no_location,53 years ago this week is the anniversary of marilyn monroes death ripriprip,0
3049,death,?s????ss? a?????,aris hints and snippets will be the death of me,0
3051,death,Chicago,tomorrow will be the death of me,0
3052,death,"Alicante, Spain",new new york city legionnaires disease death toll rises follow,1
3053,deaths,no_location,vaxshill 2 deaths from measles complications in 10 yrs everyone looses their shit 8 dead from legionnaires in a month crickets,1
3054,deaths,no_location,bigamist and his first wife are charged in the deaths of his second pregnant wife her child 8 her mother her nephew 1 and their you,0
3055,deaths,"Mooresville, NC",do not get on i77 south huge wreck and airlift and maybe some deaths interstate is completely blocked,1
3056,deaths,"Mooseknuckle, Maine",lolgop 22 cases of voter fraud a year we need new laws 83 gun deaths a day who actually follows laws amirite vra50,1
3057,deaths,"Palermo, Sicily",silence palermo shipwreck children deaths,1
3058,deaths,no_location,this why bsf jawans died fidayeen has aks and they bloody insas insas rifles not to blame for soldiers deaths mod,1
3059,deaths,AsunciÌ_n-PY / TÌ_bingen-GER,breast milk is the original superfood but rates worldwide have stalled below 40 contributing to more than 800000 child deaths last year,0
3060,deaths,"Voorhees, NJ",12 of the deaths in redlight running crashes are pedestrians bicyclists other vehicle occupants that are hit by the redlight runners,1
3061,deaths,no_location,retweet truediagnosis 250k deaths per year from physician error how to avoid being one of them,1
3062,deaths,no_location,cdcwhistleblower 2 deaths from measles complications in 10 yrs everyone looses their shit 8 dead from legionnaires in a month crickets,1
3064,deaths,no_location,bigamist and his first wife are charged in the deaths of his second pregnant wife her child 8 her news,0
3066,deaths,UK,500 deaths a year from foodborne illness frackfreelancs dears deccgovuk frackfreeeu tarletonsophie,1
3068,deaths,"Atlanta, GA",hear drfriedencdc talk on how to avoid thounited states of americands of resistant infectionsdeaths in next 5 yrs adiossuperbacterias,0
3070,deaths,Planet Earth,irony just died a thounited states of americand deaths,0
3071,deaths,Wakanda,strickskin nickscomics laughing out loud usually but i am being objective here maybe uncle ben of course most deaths end up business as usual,0
3072,deaths,Lagos,comment deaths of older children what do the data tell united states nghlth,1
3073,deaths,Does it really matter!,deaths 7,1
3074,deaths,no_location,eazzyp we will never know what would have happened but the govt seemed to think that their beliefs warranted the deaths of innocent japs,1
3075,deaths,Your screen,real magic in real life women went missing in ohio town the focus of fbi probe after strange deaths and,1
3077,deaths,"Phoenix, AZ",no two cases do not constitute an epidemic plague health publichealth,1
3079,deaths,Does it really matter!,deaths 3,0
3080,deaths,Edinburgh,had lunch with stewart julian only a couple of hours earlier good to finally find out what happened to them,0
3082,deaths,Weyburn,weyburn police warn public after fentanyl deaths in province,1
3083,deaths,UGA '15 Alumnus - Economics ,none of you annoying crusty all lives matter head ass people ever actually supoort causes you just hate when black deaths get attention,0
3084,deaths,no_location,it is time to reduce gun deaths,1
3085,deaths,no_location,gregorysanders usdot the stat of high auto deaths applies to children in a vehicle i guess they can out run lightrail better than adult,0
3086,deaths,Blackpool,cancers equate for around 25 of all deaths in blackpool knowing the signs could save your life be clear on cancer,1
3089,deaths,"the void, U.S.A",highqualitybird a reverse situation laughing out loud i do not know 911 where united states civilian deaths were specifically utilized to make a political,1
3090,deaths,london town..,heard theres two more deaths and a murder chrissie kills adam val and finn die emmerdale,0
3091,deaths,Tennessee/Gallifrey,mathewisangry z3kesk1 saladinahmed they died horrible deaths trapped in the ships but they knew that was a risk,1
3092,deaths,"Amman, Jordan",fco minister tobiasellwood condemns attack at a mosque in saudi arabia that has resulted in at least 15 deaths,1
3095,deaths,"Washington, D.C.",critters climate and two plague deaths in colorado,1
3097,deaths,no_location,since 1940 the year angela sanders was born roundhouse kick related deaths have increased 13000 percent,1
3099,deaths,"Columbia Heights, MN",walmart is taking steps to keep children safe in hot vehicles take a look at the innovative car seat here,0
3100,deaths,Top Secret,as of 2010 there were 17 beluga deaths reported at seaworld their average age 15 12 years opseaworld,1
3101,deaths,"ÌÏT: 10.614817868480726,12.195582811791382",bigamist and his first wife are charged in the deaths of his second pregnant wife her child 8 her mothe,1
3102,deaths,Top secret bunker ,mayoroflondon pls reduce cyclist deaths with a compulsory highway code test as with every other vehicle that uses a road notrocketscience,1
3104,debris,"Belbroughton, England",aerospace exec plane debris is from missing malaysia airlines flight 370 part of the aircraft wing found on reunion island is from th,1
3105,debris,no_location,malaysia airlines flight 370 that disappeared 17months ago debris found south of the indian ocean,1
3106,debris,no_location,malaysia airlines flight 370 aircraft debris found on los angeles reunion is from missing malaysia airlines,1
3107,debris,772 Temperance Permenence,discovered plane debris is from missing malaysia airlines flight 370 time,1
3108,debris,no_location,confirmed the debris from malaysia airlines flight 370,1
3111,debris,Nigeria ,malaysia confirms plane debris washed up on reunion island is from flight malaysia airlines flight 370,1
3114,debris,"46.950109,7.439469",how missing jets debris could have floated to reunion the new york times,1
3115,debris,no_location,reunion debris is almost surely from flight 370 officials say new york times,1
3117,debris,In the Shadows,the debris found on reunion island was from flight malaysia airlines flight 370 the mystery behind that plane disappearance could be better than any novel,1
3119,debris,Campo Grande-MS,reuters debris confirmed from malaysia airlines flight 370 relatives hope for discovery of crash site,1
3120,debris,nbc washington,nbcnightlynews malaysian officials say debris found on reunion island is from malaysia airlines flight 370 bill neely reports,1
3122,debris,no_location,malaysia airlines flight 370 debris found on reunion island sad tragedy innocent crash mh370,1
3123,debris,Seattle,love food fun malaysian prime minister najib razak confirmed that the aircraft debris found on reunion isla,1
3124,debris,"Hamilton, Ontario Canada",malaysia seem more certain than france plane debris is from missing malaysia airlines flight 370,1
3125,debris,New York,malaysian officials say debris found on reunion island is from malaysia airlines flight 370 bill neely reports,1
3130,debris,no_location,debris found on reunion island comes from malaysia airlines flight 370 malaysian prime minister,1
3131,debris,no_location,aircraft debris found on island is from malaysia airlines flight 370 malaysia confirms,1
3132,debris,"Dubai, United Arab Emirates",what irony debris of flight malaysia airlines flight 370 found on reunion island,1
3133,debris,India,malaysia airlines flight 370 aircraft debris found on los angeles reunion is from missing malaysia airlines abc online,1
3134,debris,Hong Kong,malaysia airlines flight 370 reunion debris is from missing malaysia flight,1
3136,debris,"Berlin, Germany",experts leave lab as malaysia confirms debris is from malaysia airlines flight 370,1
3138,debris,IRAQ,kamindoz reuters debris confirmed from malaysia airlines flight 370 relatives hope for discovery of crash s,1
3139,debris,no_location,plane debris discovered on reunion island belongs to flight malaysia airlines flight 370 malaysian prime minister,1
3140,debris,"Tampa, FL",debris confirmed from malaysia airlines flight 370 relatives hope for discovery of crash site malaysian officials confirm a breakth,1
3141,debris,World news,abc onlinemalaysia airlines flight 370 aircraft debris found on los angeles reunion is from missing malaysia airlines abc onlinea piece of aircraft debris which,1
