id,keyword,location,text,target_relabeled
1,no_keyword,no_location,our deeds are the reason of this earthquake may allah forgive united states all,1
4,no_keyword,no_location,forest fire near los angeles ronge sask canada,1
5,no_keyword,no_location,all residents asked to shelter in place are being notified by officers no other evacuation or shelter in place orders are expected,1
6,no_keyword,no_location,13000 people receive wildfires evacuation orders in california,1
7,no_keyword,no_location,just got sent this photo from ruby alaska as smoke from wildfires pours into a school,1
8,no_keyword,no_location,rocky fire update california highway 20 closed in both directions due to lake county fire cafire wildfires,1
10,no_keyword,no_location,flood disaster heavy rain causes flash flooding of streets in manitou colorado springs areas,1
13,no_keyword,no_location,i am on top of the hill and i can see a fire in the woods,1
14,no_keyword,no_location,there is an emergency evacuation happening now in the building across the street,1
15,no_keyword,no_location,i am afraid that the tornado is coming to our area,1
16,no_keyword,no_location,three people died from the heat wave so far,1
17,no_keyword,no_location,haha south tampa is getting flooded hah wait a second i live in south tampa what am i gonna do what am i gonna do fvck flooding,1
18,no_keyword,no_location,raining flooding florida tampabay tampa 18 or 19 days i have lost count,1
19,no_keyword,no_location,flood in bago myanmar we arrived bago,1
20,no_keyword,no_location,damage to school bus on 80 in multi car crash breaking,1
23,no_keyword,no_location,what is up man,0
24,no_keyword,no_location,i love fruits,0
25,no_keyword,no_location,summer is lovely,0
26,no_keyword,no_location,my car is so fast,0
28,no_keyword,no_location,what a goooooooaaaaaal,0
31,no_keyword,no_location,this is ridiculous,0
32,no_keyword,no_location,london is cool,0
33,no_keyword,no_location,love skiing,0
34,no_keyword,no_location,what a wonderful day,0
36,no_keyword,no_location,looooool,0
37,no_keyword,no_location,no wayi cannot eat that shit,0
38,no_keyword,no_location,was in new york city last week,0
39,no_keyword,no_location,love my girlfriend,0
40,no_keyword,no_location,cooool,0
41,no_keyword,no_location,do you like pasta,0
44,no_keyword,no_location,the end,0
48,ablaze,Birmingham,bbcmtd wholesale markets ablaze,1
49,ablaze,Est. September 2012 - Bristol,we always try to bring the heavy metal retweet,0
50,ablaze,AFRICA,africanbaze breaking newsnigeria flag set ablaze in aba,1
52,ablaze,"Philadelphia, PA",crying out for more set me ablaze,0
53,ablaze,"London, UK",on plus side look at the sky last night it was ablaze,0
54,ablaze,Pretoria,phdsquares mufc they have built so much hype around new acquisitions but i doubt they will set the epl ablaze this season,0
55,ablaze,World Wide!!,inec office in abia set ablaze,1
56,ablaze,no_location,barbados bridgetown jamaica two cars set ablaze santa cruz head of the saint elizabeth police superintende,1
57,ablaze,Paranaque City,ablaze for you lord d,0
59,ablaze,Live On Webcam,check these out not safe for work,0
61,ablaze,no_location,on the outside you are ablaze and alive but you are dead inside,0
62,ablaze,milky way,had an awesome time visiting the cfc head office the ancop site and ablaze thanks to tita vida for taking care of united states,0
63,ablaze,no_location,soooo pumped for ablaze southridgelife,0
64,ablaze,no_location,i wanted to set chicago ablaze with my preaching but not my hotel,0
65,ablaze,no_location,i gained 3 followers in the last week you know your stats and grow with,0
66,ablaze,"GREENSBORO,NORTH CAROLINA",how the west was burned thounited states of americands of wildfires ablaze in california alone,1
67,ablaze,no_location,building the perfect tracklist to life leave the streets ablaze,0
71,ablaze,England.,first night with retainers in it is quite weird better get used to it i have to wear them every single night for the next year at least,0
73,ablaze,"Sheffield Township, Ohio",deputies man shot before brighton home set ablaze,1
74,ablaze,India,man wife get six years jail for setting ablaze niece,1
76,ablaze,Barbados,santa cruz head of the saint elizabeth police superintendent lanford salmon has r,0
77,ablaze,Anaheim,police arsonist deliberately set black church in north carolinaablaze,1
78,ablaze,Abuja,noches elbestia alexissanchez happy to see my teammates and training hard goodnight gunners,0
79,ablaze,USA,kurds trampling on turkmen flag later set it ablaze while others vandalized offices of turkmen front in diyala,1
80,ablaze,South Africa,truck ablaze r21 voortrekker ave outside or tambo intl cargo section,1
81,ablaze,"Sao Paulo, Brazil",set our hearts ablaze and every city was a gift and every skyline was like a kiss upon the lips,0
82,ablaze,hollywoodland ,they sky was ablaze tonight in los angeles i am expecting ig and facebook to be filled with sunset shots if i know my peeps,0
83,ablaze,"Edmonton, Alberta - Treaty 6",how the west was burned thounited states of americands of wildfires ablaze in california alone climate energy,1
85,ablaze,no_location,revel in yours wmv videos by means of mac farewell ablaze wmv en route to dvd gtxrwm,0
86,ablaze,Inang Pamantasan,progressive greetings in about a month students would have set their pens ablaze in the torch publications,0
89,ablaze,Twitter Lockout in progress,rene ablaze jacinta secret 2k13 fallen skies edit march 30 2013,0
91,ablaze,"Concord, CA",navista7 steve these fires out here are something else california is a tinderbox and this clown was setting my hood ablaze news24680,1
92,ablaze,"Calgary, AB",now playing rene ablaze ian buff magnitude electronic dance music,0
93,ablaze,Birmingham,nxwestmidlands huge fire at wholesale markets ablaze,1
95,ablaze,San Francisco,ablaze what time does your talk go until i do not know if i can make it due to work,0
96,accident,CLVLND,i cannot have kids cuz i got in a bicycle accident split my testicles it is impossible for me to have kids michael you are the father,0
97,accident,"Nashville, TN",accident on i24 w nashvilletraffic traffic moving 8m slower than usual,1
98,accident,"Santa Clara, CA",accident center lane blocked in santaclara on us101 nb before great america pkwy bayarea traffic,1
100,accident,UK,had a personalinjury accident this summer read our advice see how a solicitor can help otleyhour,0
102,accident,"St. Louis, MO",saint louis caraccidentlawyer speeding among top causes of teen accidents car accident tee,0
104,accident,"Walker County, Alabama",reported motor vehicle accident in curry on herman rd near stephenson involving an overturned vehicle please use,1
105,accident,Australia,bigrigradio live accident awareness,1
107,accident,North Carolina,i77 mile marker 31 south mooresville iredell vehicle accident ramp closed at 86 118 prime minister,1
109,accident,no_location,retweet sleepjunkies sleeping pills double your risk of a car accident,0
110,accident,Norf Carolina,by accident they knew what was gon happen,0
112,accident,"San Mateo County, CA",traffic accident n cabrillo highwaymagellan av mir 080615 110358,1
113,accident,North Carolina,i77 mile marker 31 to 40 south mooresville iredell vehicle accident congestion at 86 118 prime minister,1
114,accident,"Njoro, Kenya",the pastor was not in the scene of the accident who was the owner of the range rover,1
117,accident,no_location,mom we did not get home as fast as we wished me why is that mom there was an accident and some truck spilt mayonnaise all over,0
118,accident,Your Sister's Bedroom,i was in a horrible car accident this past sunday i am finally able to get around thank you god,1
119,accident,no_location,can wait to see how pissed donnie is when i tell him i was in another accident,0
120,accident,"Arlington, TX",truckcrash overturns on fortworth interstate click here if you have been in a crash,1
121,accident,"South Bloomfield, OH",accident in ashville on united states 23 sb before sr 752 traffic,1
126,accident,no_location,carolina accident motorcyclist dies in i540 crash with car that crossed median a motorcycle rider traveling,1
128,accident,"New Hanover County, NC",for your information cadfyi accident property damagenhs999 piner rdhorndale dr,1
129,accident,Maldives,retweet naayf first accident in years turning onto chandanee magu from near mma taxi rammed into me while i was halfway turned everyone conf,1
130,accident,"Manchester, NH",accident left lane blocked in manchester on retweet 293 nb before eddy rd stop and go traffic back to nh3a delay of 4 minutes traffic,1
131,accident,"Wilmington, NC",accident property damage piner rdhorndale dr,1
132,accident,no_location,it was an accident,0
133,accident,"New Hanover County, NC",for your information cadfyi accident property damagewpd1600 s 17th saint,1
134,accident,no_location,20150806209 prime minister traffic accident no injury at 2781 willis foreman rd,1
135,accident,global,aashiqui actress anu aggarwal on her nearfatal accident,1
136,accident,Alberta | Sask. | Montana,suffield alberta accident,1
137,accident,Charlotte,9 mile backup on i77 southaccident blocking the right 2 lanes at exit 31 langtree rdconsider nc 115 or nc 150 to nc 16 as alternate,1
138,accident,"Baton Rouge, LA",has an accident changed your life we will help you determine options that can financially supoort life care plans and ongoing treatment,0
139,accident,"Hagerstown, MD",breaking there was a deadly motorcycle car accident that happened to hagerstown today i will have more details at 5 your4state whag,1
141,accident,"Gloucestershire , UK",flowri were you marinading it or was it an accident,0
143,accident,no_location,only had a car for not even a week and got in a fucking car accident motherfuckers cannot fucking drive,1
144,accident,UK,norwaymfa bahrain police had previously died in a road accident they were not killed by explosion,1
145,accident,"Nairobi, Kenya",i still have not heard church leaders of kenya coming forward to comment on the accident issue and disciplinary measures arrest pastor ganga,0
146,aftershock,Instagram - @heyimginog ,aftershockdelo scuf postscript live and the game see you,0
149,aftershock,304,the man who can drive himself further once the effort gets painful is the man who will win roger bannister,0
151,aftershock,Switzerland,320 ir icemoon aftershock dj icemoon dubstep trap music dnb electronic dance music dance ices,0
153,aftershock,304,there is no victory at bargain basement prices dwight david eisenhower,0
157,aftershock,304,nobody remembers who came in second charles schulz,0
158,aftershock,Instagram - @heyimginog ,aftershockdelo im speaking from someone that is using a scuf on xb1 most of them people will end up getting on for postscript also,0
159,aftershock,304,the harder the conflict the more glorious the triumph thomas paine,0
160,aftershock,no_location,growing up spoiled going clay pigeon shooting and crying because of the aftershock,0
161,aftershock,Somewhere Only We Know ?,so i guess no one actually wants any free aftershock tc,0
162,aftershock,no_location,aftershock was the most terrifying best roller coaster i have ever been on disclaimer i have been on very few,0
163,aftershock,Belgium,aftershock,0
170,aftershock,dope show,kjfordays i am seeing them and issues at aftershock,0
173,aftershock,"Oshawa, Canada",wisdomwed bonus 5 minute daily habits that could really improve your life how many do you already do lifehacks,0
174,aftershock,Baker City Oregon,aftershock protect yourself and profit in the next global financial meltdown by david wiedemer http,0
175,aftershock,no_location,that moment when you get on a scary roller coaster and the guy behind you is just screaming bloody murder silverwood aftershock,0
176,aftershock,no_location,aftershock 2010 full streaming youtube,0
178,aftershock,United States,15 aftershock protect yourself and profit in the next global financial book esquire attire,0
180,aftershock,304,sometimes you face difficulties not because you are doing something wrong but because you are doing something right joel osteen,0
182,aftershock,304,the only thing that stands between you and your dream is the will to try and the belief that it is actually possible joel brown,0
183,aftershock,marysville ca ,praise god that we have ministry that tells it like it is now wdyouth biblestudy,0
184,aftershock,304,remembering that you are going to die is the best way i know to avoid the trap of thinking you have something to lose steve jobs,0
185,aftershock,"Hermosa Beach, CA",tried orange aftershock today my life will never be the same,0
187,aftershock,no_location,onfireanders i love you bb,0
191,aftershock,no_location,aftershock back to school kick off was great i want to thank everyone for making it possible what a great night,0
193,aftershock,304,people who say it cannot be done should not interrupt those who are doing it george bernard shaw,0
194,aftershock,304,the first man gets the oyster the second man gets the shell andrew carnegie,0
195,aftershock,no_location,anyone need a pu tonight i play hybrid slayer ps4 eu hmu cod8sandscrims empirikgaming codawscrims 4tpkotc 4tpfa aftershockorg,0
196,airplane%20accident,"19.600858, -99.047821",experts in france begin examining airplane debris found on reunion island french air accident experts o news,1
197,airplane%20accident,Pennsylvania,strict liability in the context of an airplane accident pilot error is a common component of most aviation cr,1
198,airplane%20accident,"Salt Lake City, Utah",crobscarla your lifetime odds of dying from an airplane accident are 1 in 8015,0
199,airplane%20accident,"Palo Alto, CA",experts in france begin examining airplane debris found on reunion island french air accident experts on wedn,1
201,airplane%20accident,no_location,alexalltimelow awwww they are on an airplane accident and they are gonna die what a cuties good job,1
203,airplane%20accident,"Spain but Opa-Locka, FL",family members of osama bin laden have died in an airplane accident how ironic mhmmm gov shit i suspect,1
204,airplane%20accident,"Jaipur, India",man goes into airplane engine accident via youtube,1
205,airplane%20accident,Hyderabad Telangana INDIA,horrible accident man died in wings of airplane 29072015,1
208,airplane%20accident,"Eagle Pass, Texas",a cessna airplane accident in ocampo coahuila mexico on july 29 2015 killed four men including a state of coahuila government official,1
209,airplane%20accident,bangalore,horrible accident man died in wings airplane 29072015 watch the video,1
210,airplane%20accident,Financial News and Views,experts in france begin examining airplane debris found on reunion island french air accident experts on wednesday,1
211,airplane%20accident,no_location,experts in france begin examining airplane debris found on reunion island french air accident experts on wednesday began examining t,1
212,airplane%20accident,Indonesia,kca votejkt48id mbataweel rip binladen family members who killed in an airplanes accident,1
213,airplane%20accident,y(our) boyfriends legs ,i almost sent my coworker nudes on accident thank god for airplane mode,0
215,airplane%20accident,"New Mexico, USA",mickinyman theatlantic that or they might be killed in an airplane accident in the night a car wreck politics at it is best,0
216,airplane%20accident,Somewhere Out There,experts in france begin examining airplane debris found on reunion island french air accident experts on mlb,1
218,airplane%20accident,no_location,this is unbelievably insane man airport airplane aircraft aeroplane runway accident freaky,1
221,airplane%20accident,Not a U.S resident,united states of americama bin ladins family dead in airplane crash naturally no accident,1
222,airplane%20accident,no_location,pilot dies in plane crash at car festival via youtube crash aircraft airplane pilot death accident carfest,1
225,airplane%20accident,"Lehigh Valley, PA",strict liability in the context of an airplane accident,1
226,airplane%20accident,Canada,dtn brazil experts in france begin examining airplane debris found on reunion island french air accident exp,1
231,airplane%20accident,Thrissur,horrible accident man died in wings of airplane 29072015 what the fuck you cant believe your eyes,1
232,airplane%20accident,Havenford,nicole fletcher one of a victim of crashed airplane few times ago the accident left a little bit trauma for her although she is,1
235,airplane%20accident,India,oh my god horrible accident man died in wings of airplane,1
237,airplane%20accident,92,oh my god i do not believe this rip bro airplane accident jetengine turbojet boing g90,1
240,airplane%20accident,Israel,i had a airplane accident,1
241,airplane%20accident,Fashion Heaven. IG: TMId_,my phone looks like it was in a car ship airplane accident terrible,0
242,airplane%20accident,"San Francisco, CA",statistically i am at more of risk of getting killed by a cop than i am of dying in an airplane accident,0
243,airplane%20accident,italy,airplane crashes on house in colombia 12 people die in accident,1
244,airplane%20accident,nyc,the shooting or the airplane accident,1
245,airplane%20accident,Toronto,could a drone cause an airplane accident pilots worried about use of drones especially in close vicinity of airports,1
246,ambulance,no_location,early wake up call from my sister begging me to come over ride withher in the ambulance to the hospital rodkiai,1
247,ambulance,Jackson,twelve feared killed in pakistani air ambulance helicopter crash,1
248,ambulance,New York / Worldwide,two air ambulances on scene of serious crash between two cars and lorry in emsne,1
249,ambulance,no_location,twelve feared killed in pakistani air ambulance helicopter crash reuters yugvani,1
251,ambulance,"New Orleans, LA",leading emergency services boss welcomes new ambulance charity,0
252,ambulance,West Wales,anyone travelling aberystwythshrewsbury right now there is been an incident services at a halt just outside shrews ambulance on scene,1
254,ambulance,Happily Married with 2 kids ,ambulance sprinter automatic frontline vehicle choice of 14 lez compliant ebay,0
256,ambulance,"Cambridge, MA",new nanotech device will be able to target and destroy blood clots,0
258,ambulance,Arizona ,20skyhawkmm20 traplord29 fredosantana300 lilreese300 it was hella crazy 3 fights an ambulance and a couple mosh pits,1
260,ambulance,Mumbai,if i get run over by an ambulance am i lucky just saying random thought,0
261,ambulance,no_location,news twelve feared killed in pakistani air ambulance helicopter crash until now dna,1
263,ambulance,"Swindon,England ",tanslash waiting for an ambulance,0
264,ambulance,no_location,fouseytube you ok need a ambulance hahahah that was good,0
266,ambulance,no_location,pakistan air ambulance helicopter crash kills nine,1
267,ambulance,"Williamstown, VT",thenissonian rejected cartoons nissan are you ok do you need medical assistance i can call an ambulance if you need me to,0
268,ambulance,"North Carolina, USA",ems1 ny emts petition for 17 per hour minimum wage emergency medical services paramedics ambulance,0
273,ambulance,Loveland Colorado,kiwikaryn check out what is in my parking lot he said that until last year it was an ambulance in saint johns,0
274,ambulance,|| c h i c a g o ||,when you do not know which way an ambulance is coming from,1
276,ambulance,no_location,reuters twelve feared killed in pakistani air ambulance helicopter crash,1
279,ambulance,no_location,why is there an ambulance right outside my work,0
280,ambulance,Canada,leoblakecarter this dog thinks he is an ambulance natasharideout,0
281,ambulance,VISIT MY YOUTUBE CHANNEL.,happening now hatzolah emergency medical services ambulance responding with dual sirens and,0
287,ambulance,USA,twelve feared killed in pakistani air ambulance helicopter crash world news,1
290,ambulance,no_location,what is the police or ambulance number in lesotho any body know,0
291,ambulance,no_location,medic914 aaceorg i am surprised we still cannot standardised the clinical practice across the 11 national health service ambulance trust,0
294,ambulance,"Davidson, NC",people who try to jwalk while an ambulance is passing i hate you,0
296,annihilated,Higher Places,the episode where trunks annihilated freiza is the cleanest shit ever he showed that nigga no mercy,0
297,annihilated,"Horsemind, MI",they shall be annihilated and all of their petebests dessicated and laid bare then you shall kneel before me,0
298,annihilated,"New York, NY",uribe just annihilated that baseball mets,0
299,annihilated,Boksburg,marksmaponyane heysundowns were annihilated in their previous meeting with celticindeed its an improvement,0
301,annihilated,no_location,volfan326 tneazzy mizzou has annihilated florida the past 2 seasons even ended muschamps career just cannot compete with bama,0
302,annihilated,no_location,annihilated abs,1
303,annihilated,no_location,be annihilated for status education mba on behalf of a on easy street careen eovm,0
307,annihilated,"V-RP @OZRP_ ?MV, AU, R18+?",to luka they should all die all of them everything annihilated alois trancy,0
309,annihilated,"Greater Manchester, UK",acarewornheart have a good un fella sorry i will not be there to get annihilated with you,0
310,annihilated,Boston,cop pulls drunk driver to safety seconds before his car is hit by train via viral spell,1
312,annihilated,no_location,you must be annihilated,0
314,annihilated,The Canopy Kingdom,boom your country was just entirely annihilated by a h britain,0
315,annihilated,no_location,amirkingkhan you would have been annihilated so you might as well thank floyd mayweather,0
316,annihilated,USA,one thing for suregod has promised israel will not be annihilated but the horror of iran with nukes,0
318,annihilated,no_location,violentfeminazi i guess that is ok for armenians since we have spent most of our history getting annihilated,1
320,annihilated,no_location,70 years since we annihilated 100000 people instantly and became aware that we have the ability to annihilate the whole of humanity,1
321,annihilated,the own zone layer ,day 1 of tryouts went good minus the fact i stopped quickly to get a short ball and annihilated my toenail injury even more,0
322,annihilated,London,during the 1960s the oryx a symbol of the arabian peninsula were annihilated by hunters,1
328,annihilated,no_location,ready to get annihilated for the bucs game,1
329,annihilated,South 37,philip duncan breakfast one people annihilated by last nights weather really philip thought you would have forecast that,1
330,annihilated,no_location,domain other sophistication be annihilated closely uptotheminute feat zrnf,0
331,annihilated,"West Lancashire, UK.",stormbeard steellord i seen judas priest in 2005 when rob came back scorpions as supoort fucking annihilated the place astonishing gig,0
332,annihilated,PA,officially skipping out on fantastic fourfant4sticwhatever the hashtag is it is getting annihilated in reviews bummer,0
334,annihilated,no_location,tomcatarts thus explaining why you were all annihilated but the few or in this case you the only survivor evolved and became godlike,1
335,annihilated,Û¢ Views From The Six Û¢,just completely annihilated cech with paul keegan what a time to be alive,0
336,annihilated,no_location,tomcatarts who then were annihilated by the legion itself the survivors of the imperfect hybrid project quickly formed a new secret cell,0
337,annihilated,University of Toronto,sirbrandonknt exactly that is why the lesnarcena match from summerslam last year was so great because brock annihilated a guy who is,0
340,annihilated,Swaning Around,annihilated in damascus syrian army grinds alloosh and his gang into the manure pile,1
341,annihilated,no_location,thatdes ok i was not completely forthright i may have also been in a food coma bc of the kebabtahinipickles i also annihilated with fries,0
344,annihilated,London,a fun filled happy hour at simmons bar in camden with this handsome one i got annihilated apart from this game,0
345,annihilated,Albany/NY,juanny beisbol sr annihilated that ball lgm,0
346,annihilation,"California, USA",rvfrielectronic dance musicann hell is just a fraction of his belief of total annihilation destruction of united states of america lodisilverado ritzy jewels,1
347,annihilation,no_location,potus maybe we should call israel and tell them we are sorry are pres has sold them down the river to annihilation,0
348,annihilation,no_location,evil dead annihilation of civilization,0
349,annihilation,no_location,us national park services tonto national forest stop the annihilation of the salt river wild horse via change,1
352,annihilation,Wild Wild Web,annihilating quarter staff of annihilation,1
353,annihilation,Subconscious LA,world annihilation vs self transformation aliens attack to exterminate humans,1
354,annihilation,Spain,starmade stardate 3 planetary annihilation via youtube,1
358,annihilation,"Yeezy Taught Me , NV",kim kardashian can you please sign and share this petition to save wild horses in arizona,0
361,annihilation,CA physically- Boston Strong?,the ellen show please check into salt river horses help stop the annihilation about to happen without 54000 more signatures change org thank you,0
363,annihilation,United States,are souls punished with annihilation,0
364,annihilation,no_location,calfreedommom steph93065 not to mention a major contributor to the annihilation of israel,1
365,annihilation,no_location,willienelson we need help horses will dieplease retweet sign petitiontake a stand be a voice for them gilbert23,1
368,annihilation,"Rock Hill, SC",i reject the laws of the misguided false prophets imprison nations fueling self annihilation,0
371,annihilation,Republic of Texas,the annihilation of jeb christie kasich is less than 24 hours away please god allow me at least one more full day,0
372,annihilation,no_location,barbitwins we need helphorses will die please retweet sign petition take a stand be a voice for them gilbert23,0
