id,keyword,location,text,target_relabeled
5473,flames,no_location,sbnation flames what makes a good penalty killer,0
5475,flames,dreamy lake,i guess you can say igs hopes went up in flames,0
5476,flames,no_location,i will cry until my pity partys in flames,0
5477,flames,houstn,that new lil b x chance is nothing but flames,0
5479,flames,hell,gilderoy i wish i was good enough to add flames to my nails im on fire,1
5480,flames,"Asheville, NC",my gang walking round with them brown flames thats 100nd,0
5482,flames,St. Patrick's Purgatory,tadhgtgmtel dude was just smoking and the fucking thing went up in flames i though a bomb went off oh my god scared,1
5484,flames,no_location,maryland mansion fire that killed 6 caused by damaged plug under christmas tree report says into the flames,1
5485,flames,@cockerelshoes,new giant flames giant manly brown infoorder sms087809233445 pin2327564d,0
5486,flames,United States,you see the devastation its shocking firefighters continue to battle flames in california benstracy reports,1
5487,flames,manaus,watching it go up in flames,1
5488,flames,"Sioux Falls, S.D. ",rp said they can see smoke coming from the silo on 260th street in hartford but no flames,1
5489,flames,no_location,i chose you so if we can search for the joy of just the two of united states well be near smiles no matter what cold flames burn our bod portgassdk,0
5491,flames,Republica Dominicana,maryland mansion fire that killed 6 caused by damaged plug under christmas tree report says into the flames firefighters bravery,1
5492,flames,"Eastlake, OH",erinmariefishy everyone is setting flames upon me,0
5493,flames,"Hillsville/Lynchburg, VA",flamesnation that is the optimistic side of me no doubt it is tough but it can be done i feel like the games will pivot on defense,0
5495,flames,Some where,so pardon me while i burst into flames i have had enough of the world and its peoples mindless games,0
5496,flames,Travelling around the world ,awickedassassin want to burst into flames anna hugged him tightly,0
5497,flames," 616 Û¢ Kentwood , MI ",selmoooooo edvinnn imtariik dzaficharis selmo you not catching flames from me im just gonna be witnessing the slaughter,1
5498,flames,no_location,bloody ell let it burn rubybot,0
5499,flames,no_location,if you have an opinion and you do not put it on thh internet you will furst into flames,0
5501,flames,? Jet Life ?,i have a rising follower graph 2 more followers in the past week get your stats right here,0
5502,flames,Fairy Tail! ,aisumage akumareisu just between gray and ophelia red flames blazing around her person setting nearly everything in the area,1
5503,flames,Santo Domingo Alma Rosa ,soloquiero maryland mansion fire that killed 6 caused by damaged plug under christmas tree report says into the flames firefighte,1
5506,flames,Houston |??| Corsicana,cwhoops you better make all your shots tomorrow cause i am recording and flames will be thrown tomorrow,0
5507,flames,"Cincinnati, OH",i added a video to a youtube playlist nicki minaj up in flames official video,0
5509,flames,Bacon,he better than sean bro i can admit that sean is flames now but he better than sean,0
5510,flames,no_location,the advantages apropos of in flames favorable regard mississauga ontario pwhvgwax,0
5514,flattened,Some other mansion,flattened all cartoonylike whoa there papa,0
5515,flattened,Chicago,the road to success is paved with pennies that i flattened on the train tracks you are welcome,0
5517,flattened,"Astley, Manchester",feel like i have been flattened by a sumo wrestler no pain no gain muaytai wantmyabsback strong,0
5518,flattened,"Bow, NH",ideas in food flattened,0
5519,flattened,Leicester,zouma has just flattened him there cfc,0
5520,flattened,"Frome, Somerset, England",zouma has just absolutely flattened that guy,0
5521,flattened,Mars,flattened,0
5522,flattened,"Melbourne, Victoria",70 years ago the first atomic attack flattened hiroshima 3 days later it was nagasaki both war crimes to put moscow in its place,1
5524,flattened,UK,today august 6th is the 70th anniversary of abomb little boy been dropped on hiroshima70000 killed outright as the city was flattened,1
5525,flattened,"Essex, England",would have just flattened the little midget,0
5526,flattened,"new york, ny",who said this yosemite sam or drumpf nobody ill vote for a flattened out rabbit skin ahuh huh i always say,0
5528,flattened,somewhere too cold for me,grabakahitman izigarcia when he flattened machidadid he lose that fightnope he lost fights to guys he should not of lost to also,1
5529,flattened,Barbados,floored4 flattened early birds does get de cups so lag about pun de dock and watch people drink,0
5531,flattened,no_location,conklin being flattened shuffled feet instead of kick slide did not get hands up into chest,0
5532,flattened,Leeds,flattened thee striker,1
5534,flattened,"Wahpeton, ND",picking up flattened hay men masonite in wahpeton nd,0
5535,flattened,no_location,zouma just flattened that guy,0
5538,flattened,"Chorley, Lancashire, UK",fylde building set to be flattened one of prestons city centre iconic buildings is disappearing from the skyline,0
5539,flattened,no_location,iamhorsefly hide your kids hide your wife he is on the loose i thought i flattened you with a ball,0
5540,flattened,no_location,wouldve been great if mbiwa just flattened that little rat,0
5541,flattened,"Northampton, MA",jimmozel puckflattened ball laughing out loud,0
5544,flattened,Ventura,i do not doubt it but it was his implicit statement in doing it that makes me want him flattened by a bus,0
5545,flattened,Le Memenet,kainyunited states of americanagi grummz pixelcanuck and flattened raynor raynor was a balding imperfect biker marine not a emo generic western hero,0
5547,flattened,"Lubbock, Texas",seanpeconi jasonfloyd lynchonsports criscyborg i think the risk of losing and getting her nose flattened has a lot to do with it,0
5548,flattened,Derby,mums literally just picked up her new car today and flattened the battery already trying to sort out the bluetooth muppet,0
5552,flattened,"Mississauga, Ontario",tweetinglew tersestuff notley flattened harper in his heartland harper imported tens of thounited states of americands of that feeling when slaves cost albertans jobs,0
5553,flattened,Delhi ,twilightfairy flattened frog,0
5554,flattened,"Keighley, England",imagine getting flattened by kurt zouma,0
5555,flattened,Pomfret/Providence,the fallacy is it is up to the steam roller it is up to the object whether it will be flattened or not robertcalifornia thereisonlysex,0
5556,flattened,"Baltimore, MD",photo beach earrings beach jewelry vacation earrings keep calm and beach on earrings made with flattened,0
5557,flattened,no_location,100 1 mix new flat double sided linerless bottle caps you choose mix flattened full re,0
5558,flattened,"East Lansing, MI",bigburgerboi55 flat footballs more like he flattened the spartans from crushing them back in the day hail,0
5559,flattened,Rocketing through the galaxy,satanaofhell ever seen by far a dreamy look came over his face and his ears flattened as he started to walk slowly toward her youd,1
5561,flood,boston,when fizzy is sitting in the regular flood seats and no one knows who she is,0
5563,flood,United States,jkl cancels flash flood warning for bell harlan knox ky wx,1
5564,flood,New York,spot flood combo 53 inch 300w curved cree led work light bar 4x4 offroad fog lamp full re,0
5567,flood,"Warrandyte, Australia",a small flood with bigconsequences,1
5569,flood,"British Columbia, Canada",homecoming queen killed on way home from the prom by flood waters social news,1
5570,flood,no_location,2pcs 18w cree led work light offroad lamp car truck boat mining 4wd flood beam full rea,1
5573,flood,no_location,it is been raining since you left me now i am drowning in the flood you see i have always been a fighter but without you i give up,0
5575,flood,Aix-en-Provence/Utrecht,creationmin rwrabbit gooneratheist atheistic1 lolatjesus yet still why did so many fish die in the worldwide flood i wonder,0
5576,flood,Philadelphia,and please do not flood poor robertbenglunds mentions he is put in his work,1
5578,flood,"Van Buren, MO",atlarnxx but he didnt,0
5579,flood,New York,12 72w cree led work light bar alloy spot flood combo diving offroad 4wd boat full read,0
5581,flood,"Niagara Falls, Ontario",hellotybeeren cue the flood of people ironically calling you that,0
5582,flood,USA,motors hot deals 452 10x 27w 12v 24v led work light flood lamp tractor truck suv utv a,0
5584,flood,no_location,85v265v 10w led warm white light motion sensor outdoor flood light pir lamp auc,0
5586,flood,Hawaii USA,iembothfo at 1000 am 2 nnw hana maui co hi county official reports coastal flood,1
5587,flood,New York,1 pair new 27w 4 round led work driving flood light offroad atv utv full read by ebay,0
5589,flood,no_location,internet basics the flood defective intertissue is soul mate the milk trench host guabxfv,1
5590,flood,no_location,bmx issues areal flood advisory for shelby al till aug 5 900 prime minister cdt,1
5593,flood,USA,flood advisory in effect for shelby county in al until 9 prime minister alabama weather,1
5594,flood,United States,retweet grantfactory grants funds weymouth meeting on seawalls and flood grants set for thursday night,1
5600,flood,United States,flood advisory issued august 05 at 428pm edt by nws wxky,1
5602,flood,no_location,survived the plague floated the flood just peeked our heads above the mud no ones immune deafening bells my god will we survive ourselves,0
5604,flood,USA,flood prone waterways in westchester county now eligible for millions in state aid new york,1
5605,flood,Waddesdon,chinese rescue team arrives in myanmar to help flood victims sittway,1
5608,flood,"Knoxville, TN",flood advisory issued august 05 at 710pm cdt until august 05 at 800pm cdt by nws the urban and weather,1
5611,flooding,"Rock Springs, WY",rock springs residents living off elk street continue to battle flooding issues after mondays rain storm while,1
5612,flooding,Vietnam,cuban leader extends sympathy to vietnam over flooding at,1
5613,flooding,"Tampa-St. Petersburg, FL",business at the sponge docks washed out by rain flooding,1
5614,flooding,no_location,warlordqueen he thrusts a little more before he jams his cock deep inside her flooding her womb and pussy with his hot thick cum,0
5617,flooding,USA,severe thunderstorms and flash flooding possible in the midsouth and midwest weather environment climate nature,1
5618,flooding,"Huntsville, Alabama",1130a radar update widespread showersstorms but moving over the same areasminor flooding possible hunwx,1
5619,flooding,"Nova Scotia, Canada",tips to prevent basement leaks create control joints to eliminate random cracking homeimprovement flooding,0
5620,flooding,no_location,flooding,1
5621,flooding,Metro Manila,adorableappple no reported flooding po in the area ten4 mmda,0
5622,flooding,no_location,flooding kills 166 displace over one million in pakistan daily news analysis yugvani,1
5624,flooding,Breaking News,flooding kills 166 displace over one million in pakistan daily news analysis,1
5625,flooding,Jakarta/Kuala Lumpur/S'pore,laos flooding 10 villages underwater world vision responding,1
5626,flooding,UK,floods ukfloods british trekkers rescued amid flash floods in himalayas a group of british tr flooding,1
5627,flooding,no_location,slopeofhope maybe the plan is to dilute until they can safely say we have to start charging or it is over longs would come flooding in,0
5629,flooding,no_location,ill only direct message hotel info because people are flooding my notifications asking me for info,0
5631,flooding,I ACCEPT SONG REQUESTS,when the waves are flooding the shore and i cannot find my way home anymore that is when i look at you,1
5632,flooding,"Honolulu, Hawaii",if flooding occurs in your home how to stop mold growth via proudgreenhome,1
5633,flooding,no_location,flooding of tracks caused derailment sa indian subcontinent indian subcontinent,1
5634,flooding,"Miami Beach, Fl",the chinese are flooding new york city market like never before,0
5635,flooding,Republic of Texas,obama keeps 27 iraqi christian asylum seekers ndetention while flooding united states withunscreened muslims via dcclothesline,1
5638,flooding,"California, USA",so grateful for all the supoort flooding in from netkicorp dinner guests thank you all,1
5641,flooding,Huntsville AL,there some flash flooding in madison valleywx,1
5642,flooding,? ,themaine is it too soon to start flooding your comment section with come to brazil comments bc i will,0
5644,flooding,don't run,and last year it was just a lot of the drums are flooding and janice i am falling,0
5645,flooding,West Midlands,bbcengland a burst water main causes major flooding at a birmingham hospital oh my god,1
5646,flooding,Jakarta/Kuala Lumpur/S'pore,heavy rainfall and flooding in northern vietnam situation report no2,1
5647,flooding,no_location,crabbycale oh my god the memories are flooding back,0
5650,flooding,Global-NoLocation,flood disaster burst water pipe floods apartments at nycha senior center ny1 ny1burst water pipe floods a,1
5651,flooding,no_location,lrt look at all my tom feels flooding back,0
5652,flooding,Jakarta/Kuala Lumpur/S'pore,myanmar msf assisting thounited states of americands as worst flooding in decades hits parts of myanmar,1
5653,flooding,"Ocean City, NJ",residents in the central part of ocean city heard from engineers about flood mitigation options tuesday ocnj,1
5654,flooding,no_location,wen i finally get the girl i want i am flooding yall wit all pics of united states rs though,0
5655,flooding,belleville,kwislo i see her flooding at mad decent,0
5656,flooding,"Kualar Lumpur, Malaysia",monsoon flooding kills dozens in myanmar prompting calls for help,1
5657,flooding,"Austin, TX",memorial unveiled for travis county deputy killed in sept flooding travis county sheriff greg hamilton joined,1
5658,flooding,no_location,flooding kills 166 displace over one million in pakistan at least 166 people have been killed and nearly 11 lakh,1
5659,flooding,"Nadiad ,Gujarat , India!!",thankkk you all soo much for flooding my notificationsu my fella parsholics r superb jus soo awesomelove love you all always frvrgrateful,0
5661,floods,South of D.C.,slip sliding away flash floods info for writers withtony nester sonoranrattler writingtips,1
5662,floods,no_location,who is bringing the tornadoes and floods who is bringing the climate change god is after america he is plaguing her farrakhan quote,1
5663,floods,Adventist - Lesson Sabbath,myanmar flooding heavy monsoon rains during the month of july have caused flooding flash floods and landsli,1
5664,floods,Australia,in india 119000 people have taken shelter in the 966 relief camps the government has set up after the floods,1
5665,floods,no_location,stephen harper do not worry i am sure climate has nothing to do with hail floods tornados in alberta ontario i am sure gods just mad at you,1
5668,floods,Passamaquoddy,ictyosaur i never thought it would be a what the fuck moment yet it is here after months of 90 degree heat next we will have flash floods,1
5669,floods,Û¢III.XII.MMXIÛ¢,granted like half my town floods when it rains but still whatever,1
5670,floods,"Sherwood, Brisbane, Australia",madonnamking rspca site multiple 7 story high rise buildings next to low density character residential in an area that floods,0
5671,floods,canada,cyberdemon531 i hope that mountain dew erodes your throat and floods your lungs leaving you to drown to death,1
5672,floods,Michigan,disaster group stunned by floods,1
5673,floods,london,there is this person they reckon when you are dying your brain floods with dmt causing you to relive your life in real time in a simulation,0
5674,floods,no_location,have you ever remembered an old song something you have not heared for years words that carry floods of memories all along priceless,0
5675,floods,California,floods fishing finally sunshine fab deals from albertsons anniversary sale lauren paints a beautiful life,0
5676,floods,Global-NoLocation,flood disaster bengal floods cm mamata banerjee blames dvc bjp claims state failed to use economic t,1
5677,floods,no_location,69 dead due to floods in myanmar naypyidaw aug 5 prensa latina the death toll rose today to 69 in myanmar,1
5680,floods,Estados Unidos,typhoon soudelor approaches after 7 killed 2 missing in floods in philippines via abc 7 chicago,1
5683,floods,New Jersey,casewrites when it rains in nj it flash floods otherwise its just a desert of grief and taxes,1
5684,floods,"New York, NY",download itunes floods of glory by luiz santos jazz art music,0
5685,floods,"Timaru District, New Zealand",contactenergy yep during floods of 1999 or 2000 clyde dam releasing every bit of water it could most speccy ev charging your way,1
5686,floods,Cameroon,bamenda floods kill animals birds,1
5687,floods,"St Austell, Cornwall",i hope it rains throughout the whole weekend i hope it floods and the portaloos become sentient,0
5688,floods,"Ogba, Lagos, Nigeria",apc chieftain tasks dickson on n15b floods donation to bayelsa,1
5689,floods,Philippines,pagasa 712am yellow warning panay island guimaras negros possible floods in lowlying areas landslides in mountainous areas,1
5690,floods,no_location,retweet 40hourfamine in bangladesh government has not declared floods an emergency worldvision will continue to m,1
5692,floods,North America,nearly 50 thounited states of americand people affected by floods in paraguay,1
5693,floods,Earth,etp bengal floods cm mamata banerjee blames dvc bjp claims state failed to use relief funds even as flood w,1
5694,floods,no_location,may allah help all those suffering from the pakistan floods you and your families are in our dua,1
5695,floods,no_location,children in myanmar face a double catastrophe as floods hit the most,1
5698,floods,"New York, USA",love when drake floods instagram makes you feel real in tune with everything he did like you was there or sumn,0
5703,floods,no_location,69 die in myanmar floods 250000 affected,1
5704,floods,no_location,typhoon soudelor approaches after 7 killed 2 missing in floods in philippines typhoon,1
5705,floods,no_location,memphis always floods,1
5706,floods,"21.462446,-158.022017",floods cause damage and death across asia all media content 05082015,1
5707,floods,Rio de Janeiro,as soon as maintenance ends everyone floods the servers servers destroyed by extreme load maintenance starts anew,0
5711,forest%20fire,no_location,e112 particulatebreak up of solid combust fossil fuel voltaic active forest fire biological vocpetroleum ch4 bacteria decomposition,1
5712,forest%20fire,PDX,be careful anyone who lives west of beaverton forest grove has a rapidly spreading fire heading east,1
5713,forest%20fire,Shelby County,i added a video to a youtube playlist ori and the bind forest ep 6 fire and death,1
5714,forest%20fire,no_location,how is it one careless match can start a forest fire but it takes a whole box to start a campfire,1
5715,forest%20fire,port matilda pa,our little forest fire wardens,1
5716,forest%20fire,"Concord, N.C.",fire in pisgah national forest grows to 375 acres,1
5717,forest%20fire,"Redding, California, USA",ashenforest floorburnt manzanita timber on johnson fire along ridge on forest road 1 route complex,1
5719,forest%20fire,no_location,sweet2young runs at her for setting my forest on fire and bites the shit out of her neck,1
5720,forest%20fire,no_location,hornybigbadwolf sets the forest on fire,1
5721,forest%20fire,"Slatina,Romania",i liked a youtube video j cole fire squad 2014 forest hills drive,0
5722,forest%20fire,"Redding, California, USA",view of smoke column rising above the south end of the blake fire along forest road 1 route complex,1
5724,forest%20fire,no_location,it starts a forest fire that cannot be put out,1
5727,forest%20fire,no_location,i had to grill for a school function one of the grills we had going was pretty much either off or forest fire no inbetween made it work,0
5729,forest%20fire,no_location,515p for those who watch over me forest fire smoke has lifted nuff fme tmake a run tthe pet store on the highway n i will bhome by 7p,1
5730,forest%20fire,Los Angeles for now,we are having forest fires out here in socal but the only fire you should watch for is ybtheprophet realhiphop,1
5732,forest%20fire,????????????,us forest service firefighter david ruhl 38 died in the frog fire in the modoc national forest he had been temporarily reassigned,1
5733,forest%20fire,Western Washington,usfs an acronym for united states fire service,0
5736,forest%20fires,no_location,only you can prevent forest fires,1
5739,forest%20fires,no_location,naturaldisasters as california fires rage the forest service sounds the alarm about rising wildfire costs,1
5740,forest%20fires,no_location,q why do ducks have big flat feet a to stamp out forest fires q why do elephants have big flat feet a to stamp out flaming ducks,0
5741,forest%20fires,"alberta, canada",gilmanrocks7 wow where is this for the rest of the summer i usually have to worry about forest fires calgary is about 8 hours away,1
5743,forest%20fires,"Washington, D.C.",as california fires rage forest service sounds the alarm about sharply rising wildfire costs,1
5744,forest%20fires,no_location,a little concerned about the number of forest fires where i will be living,1
5745,forest%20fires,no_location,nycdivorcelaw trump is a climate denier algae bloom in the pacific from california to alska seeweed in caribean forest fires snowball inhofe,1
5746,forest%20fires,Montana ,the forest service now spends 50 of its budget fighting fires,1
5748,forest%20fires,no_location,cartoon bears without them we would qave no knowlddge of forest fires or toilet paper,0
5751,forest%20fires,no_location,this is the first year the forest service spent more than half its annual budget on fighting fires climatechange,1
5752,forest%20fires,no_location,as california fires rage the forest service sounds the alarm about rising wildfire costs,1
5753,forest%20fires,no_location,reddit lightning sparks new fires in boise national forest rstormcoming,1
5754,forest%20fires,San Francisco,the spread of conflict palmoil has sparked an increase in fires destroying forest throughout indonesia,1
5757,forest%20fires,Cape Cod,photo blue by forestfires source,1
5758,forest%20fires,no_location,i am about to cook your smokey the bear saving forest fires face ass,0
5759,forest%20fires,Nicola Valley,forest fires dying salmon time 2 act not deny climate change nightmares are here bcpoli canpoli vanpoli,1
5760,forest%20fires,Tips on my blog at,tales of the trees deep water loving lake tahoe and no forest fires,0
5763,forest%20fires,"Boise, Idaho",852015 430 prime minister progress being made on boise forest fires,1
5764,forest%20fires,no_location,a group of florida forest service firefighters could be deployed to california to help contain fires details at 10,1
5765,forest%20fires,no_location,pray for east coast forest fires pray that they be put out pray for rain,1
5766,forest%20fires,Duncan,bluejays braves angels instead of dumping water on yourselves please send it to british columbia to help with the forest fires,1
5769,forest%20fires,no_location,heartdisease united states forest service says spending more than half of budget on fires,1
5771,forest%20fires,Texas ,no pharrell only you can prevent forest fires,0
5772,forest%20fires,no_location,climate consequences united states forest service says spending more than half of budget on fires,1
5775,forest%20fires,no_location,us forest service says spending more than half of budget on fires,1
5776,forest%20fires,Based in CA - Serve Nationwide,property losses from northern california wildfire nearly double via yahoonews,1
5777,forest%20fires,"Portland, Oregon",inciweb or update rogue riversiskiyou national forest fires 8515 1200 prime minister rogue riversiskiyou nf area,1
5778,forest%20fires,"Vancouver, BC",forest fires could delay abbyairshow but officials say it could be a good thing,1
5780,forest%20fires,"Lansdale,Pennsylvania",us forest service says spending more than half of budget on fires by ian simpson,1
5781,forest%20fires,no_location,campsite recommendations toilets shower pub fires no kids pizza shop forest pretty stream no midges no snakes thanks,1
5783,forest%20fires,no_location,when ur friend and you are talking about forest fires in a forest and he tells you to drop ur mix tape out there straightfire,1
5784,forest%20fires,"Sacramento, CA",firefighting consumes forest service budget sparks political clash forest service report cites increasing cost of,1
5789,hail,"Carol Stream, Illinois",great michigan technique camp b1g thanks to bmurph1019 hailyoutsey termn8r13 goblue wrestleon,1
5790,hail,no_location,np avenged sevenfold hail to the king,0
5791,hail,no_location,all hail shadow hybrid mix feat mike szuter youtube youtube,1
5792,hail,Calgary/Airdrie/RedDeer/AB,tremblayeh we like big hail and we cannot lie sirmixalot,0
5793,hail,United States,lzk issues severe thunderstorm warning wind 60 miles per hour hail 075 in for sharp ar till 815 prime minister cdt wx,1
5794,hail,"Hattiesburg, MS",two great dawgs dak and jak hail state,0
5795,hail,Arkansas,strong thunderstorm 4 miles north of arkansas moving se at 25 miles per hour large hail and wind gusts up to 50 miles per hour poss arkansas weather,1
5797,hail,United States,rnk issues severe thunderstorm warning wind 60 miles per hour hail 100 in for rockingham stokes nc till aug 5 1000 prime minister edt,1
5798,hail,no_location,thank you so so much to everyone for posting the rain and hail outside i had no idea guys,0
5799,hail,"Dagenham, Essex",chojo everyone hail to the pumpkin king,0
5800,hail,Inside the Beltway (DC Area),cue storm with massive wind and hail now a power outage wxii in davidson county,1
5801,hail,no_location,heyseto enjoy hopefully there will be no epic hail storms where you are going,0
